"Tossup Question","Answer","Category","Author","Edited","Packet","Question Number","Comments","Id"
"In one story written in this language, a sheep with no wool flees into the plain after having a conversation with some horses and lamenting that they are driven by men. A revised version of that text by Hermann Hirt included labialized and palatized velars, and later Douglas Q. Adams published a version of that story which incorporated the laryngeal theory of this language's phonology. That text in this language was first composed by linguist August (*) Schleicher. Another story in this language was composed by Eric P. Hamp in an attempt to reconstruct the ""ancestor"" to a short passage from ancient Indian scriptures. Despite the fact that this language's speakers, whose homeland is the subject of the Kurgan hypothesis, did not have a writing system, linguists have reconstructed it through the use of the comparative method. For 10 points, identify this language spoken between 3,000 and 6,000 years ago whose daughter languages are now spoken across Europe and India.","_Proto-Indo-European_ [or _PIE_, do not accept ""Indo-European"", because that is not a language]","Social Science - Linguistics","Thompson","True","Packet 01","999","","10987"
"A character of this type named Adam Link reads a copy of ~Frankenstein~ after being incorrectly accused of causing the death of Charles in one story. One character of this type asks Agatha ""Do you understand, I shall always, always be there"" after saving her from being hit by a car in another story. In one short story, a character of this type gives the response ""THERE IS AS YET INSUFFICIENT (*) DATA FOR A MEANINGFUL ANSWER"" in response to repeated inquiries about how to reverse entropy. One character of this type murders a man after losing to him at chess in an Ambrose Bierce story named for that character. Moxon's Master is, for ten points, what type of character that also includes Multivac, HAL 9000, and the Electric Grandmother, common in science fiction works by authors like Isaac Asimov?","_robot_s [or _computer_s, or _AI_, or other obvious equivalents; prompt on __artificial__ or __non-human__]","Literature - American","Thompson","True","Packet 01","999","","11018"
"In a short story by this author, Pennifeather is cleared of murdering his uncle when a box supposedly containing Chateau-Margaux turns out to contain the corpse of that uncle, Barnabas Shuttlesworthy, prompting ""Old Charley Goodfellow"" to confess to murdering him. This author of ""'Thou Art the Man'"" wrote another short story in which a high rock named after the Bessop family turns out to be the ""bishop's hostel."" That story begins with (*) William Legrand finding a shiny ""scarabaeus"" with spots that look like a ""death's-head."" The narrator of another short story by this author asks ""why will you say I am mad?,"" kills an old man whose ""pale blue eye"" distresses him, and hides the body under the floorboards. For 10 points, name this author of ""The Gold-Bug"" and ""The Tell-Tale Heart.""","Edgar Allan _Poe_","Literature - American","Hankin","True","Packet 10","999","","11025"
"A poem by this man warns ""No memory of having starred / Atones for later disregard / Or keeps the end from being hard."" That poem by this author is about Abishag, ""the picture pride of Hollywood."" Another poem by this author opens with a woman taking a ""doubtful step"" and ""Looking back over her shoulder at some fear"" while descending a staircase to meet her husband, who ""saw her.../Before she saw him."" The speaker of another poem by this man claims to have ""(*) looked down the saddest city lane"" and ""outwalked the furthest city light."" In another poem by this man, the speaker's horse ""gives his harness bells a shake""; the speaker of that poem has ""miles to go before I sleep."" For 10 points, name this American poet of ""Acquainted With the Night"" and ""Stopping by Woods on a Snowy Evening.""","Robert _Frost_ \(The first two sentences refer to the poem ""Provide, Provide.""\)","Literature - American","Hankin","True","Packet 08","999","","11026"
"This novel notes that ""~camaraderie~...superadded to love between the sexes"" is ""the only love which is strong as death."" A gathering place in this novel, Warren's Malthouse, sells ale in a big mug called a ""God-forgive-me."" At the end of its first chapter, the male protagonist says ""'Vanity'"" is the greatest fault of its female protagonist, whom he had seen sitting on a wagon and looking at herself in a mirror. That man later erases the words ""and (*) child"" from the coffin of Fanny Robin. Near the end of this novel, a man thought drowned crashes a Christmas party and is shot by William Boldwood. This novel ends with the marriage of Gabriel Oak and Bathsheba Everdene. For 10 points, name this Thomas Hardy novel whose title comes from Thomas Gray's ""Elegy Written in a Country Churchyard.""","_~Far From the Madding Crowd~_","Literature - British","Hankin","True","Packet 02","999","","11027"
"This poet identified ""the worst pang that sorrow ever bore"" as ""Knowing my heart's best treasure was no more: / That neither present time, nor years unborn / Could to my sight that heavenly face restore."" The title girl of one of his poems – who some say ""sings a solitary song / That whistles in the wind"" – shares her first name with a woman whose death he called ""The difference to me."" The same woman ""seemed a thing that could not feel / The (*) touch of earthly years"" in this man's poem ""A slumber did my spirit seal."" In another poem, he wrote about lying on his couch ""In vacant or in pensive mood,"" the ""inward eye / Which is the bliss of solitude,"" and the title golden flowers. For 10 points, name this author of the ""Lucy"" poems and ""I wandered lonely as a cloud,"" also called ""Daffodils.""","William _Wordsworth_","Literature - British","Hankin","True","Packet 10","999","","11028"
"After the missionary William Blackstone left Wessagusett, this present-day U.S. city was where he lived as a hermit. A newspaper printed in this city that was banned after one issue, ~Publick Occurrences Both Forreign and Domestick~, was the first printed in America. William Dalrymple's garrison entered this city at the request of colonial governor Francis Bernard. This city was organized around three churches built on three hills, of which only (*) Beacon Hill remains.This city's harbor was protected by Castle William. Another colonial governor based here, Thomas Hutchinson, was replaced by Thomas Gage. During an event in this city sparked by a crowd throwing snowballs at British soldiers, Crispus Attucks was killed. For 10 points, a 1770 ""massacre"" took place in what capital of Massachusetts?","_Boston_","History - US","Hankin","False","Packet 14","999","Hbunker: switch some clues||Hbunker: tossup WIP. I left a preliminary powermark. ||","11030"
"After a general who defeated this Native American tribe and wanted to send them home was overruled, many of them were sent to what they called ""the hot place,"" the Ponca Reservation. A leader of this tribe chosen by the U.S. was known as ""The Lawyer""; his followers were called the ""Treaty Band"" because they had agreed to the 1863 ""Steal Treaty."" Fort Lapwai was built on the land of this tribe, which won at (*) White Bird Canyon. Their war leader Looking Glass was killed after their defeat at Bear Paw Mountain, fought while they tried to flee to Canada. One of their chiefs, who said ""I will fight no more forever,"" was Chief Joseph. For 10 points, what Native American tribe of the Pacific Northwest known for their horsemanship is usually called by a French name meaning ""pierced nose""?","_Nez Percé_ [or _Nimipu_ or _Tsoop-Nit-Pa-Loo_; accept _Sahaptin_ or _Shahaptin_]","History - US","Hankin","False","Packet 03","999","","11031"
"A Norman writer named Gerald was an important chronicler of this country's medieval history, and cross-dressing men ambushed toll gates during one series of riots in this country. A ruler of this country, whose rule was recognized by another country's king in the Treaty of Montgomery, had the epithet ""the Last."" Soldiers from this country often wore leeks in their (*) caps during the middle ages, and the border between this country and its eastern neighbor was ruled by a class of ""marcher lords"" and marked by Offa's Dyke. Owen Glendower was the last native of this country to proclaim himself its prince; that title is now held by heirs to the British throne. For 10 points, name this constituent country of the UK that lies west of England.","_Wales_ [or _Cymru_; prompt on Great __Britain__ or __U__nited __K__ingdom before ""constituent"" is read]","History - Euro","Hankin","True","Packet 09","999","","11032"
"The ""double-conquest"" theory identifies these people with the Avars. Because the seven tribes of these people formed a federation with three tribes of Kavars, their neighbors called them the ""Ten Arrows."" These people destroyed Great Moravia after being recruited by Arnulf. Byzantine emperor Leo VI paid them to attack the Bulgarians, who in turn paid the Pechenegs to attack these people. After the death of a ""sacred king"" of these people named Kurszán (koor-san), their offices of ~kende~ and ~gyula~ (joo-la) were united as a single monarchy. A subgroup of this people are known as (*) ~székely~ (see-kay). Another king of these people was crowned on Christmas Day, 1000 by Pope Sylvester II. In 955, they were defeated by Otto the Great at the Battle of Lechfeld. These people crossed the Carpathian Mountains in 895 AD, invading the Pannonian Basin. Árpád and Saint Stephen ruled, for 10 points, what Finno-Ugric people who settled what is now Hungary?","_Magyar_s [or _magyarok_; accept _Hungarian_s before ""Hungary""]","History - Euro","Hankin","False","Packet 16","999","","11034"
"The death of a member of this family was witnessed and described by the satiric poet Pietro Aretino, and came after his failed attack on Governolo. That member of this family ordered his soldiers' armor to be burnished black after the death of Pope Leo X, earning him the epithet ""of the Black Bands."" Another of its members was granted a monopoly over the alum mines at Tolfa, and assembled a collection of ancient manuscripts that later formed the core of the (*) Laurentian library. Yet another member of this family was targeted by a plot that sought to replace him with Francesco Salviati, archbishop of Pisa; that was the Pazzi Conspiracy. They were briefly deposed by Savonarola. Cosimo the Elder and Lorenzo the Magnificent were members of, for 10 points, what family that ruled Florence?","the _Medici_s","History - Euro","Hankin","False","Packet 08","999","","11035"
"In the 1780s, a ruler with this name faced his country's ""Patriot Time"" and the 1787 revolution that those Patriots launched, which a Prussian army put down. Another prince of this name used the motto ""je maintiendirai"". That prince was recognized as ""protector"" of his country ""in the absence of His Royal Majesty"" by an assembly at Dordrecht, and was the driving force behind the Pacification of Ghent. That man led a force of naval ""sea (*) beggars"" and was assassinated by Balthasar Girard after fighting the Duke of Alba in the Eighty Years' War to gain his country's independence. A king of this name was invited by the Immortal Seven to depose James II in the Glorious Revolution. For 10 points, give this name of the Dutch prince who ascended the English throne with his wife Mary.","_William_ [or _Willem_; accept any regnal numbers; accept _William_, prince of _Orange_ or _Willem_, prins van _Oranje_; accept _William the Silent_ or _Willem de Zwijger_]","History - Euro","Hankin","True","Packet 07","999","Hbunker: is this getting cut?||","11036"
"During this war, a London Times article called the country where it took place a ""cockpit"": meaning a distorting mirror. An aerial bombardment in this war destroyed a town's sacred 600-year-old oak tree, and targeted the Rentería Bridge. One of its causes was the CEDA's fall from power, which prompted a coup led by José Sanjurjo. Following this war's Battle of Teruel, an unsuccessful attack on the bend of a river was ordered by Prime Minister (*) Juan Negrin. During this war, Emilio Mola coined the term ""fifth column."" Units in this war included the German ""Condor Legion,"" and ""International Brigades"" such as the Abraham Lincoln Brigade. Battles at the Ebro and Guernica were fought during, for 10 points, what war that brought Francisco Franco to power in an Iberian country?","_Spanish Civil_ War [or ~Guerra _Civil Española_~; prompt on __~Guerra Civil~__ or __~La Guerra~__]","History - Euro","Hankin","False","Packet 02","999","","11037"
"A book of the Bible ascribed to this man tells readers to ""gird up the loins of your mind,"" and quotes Isaiah's claim that ""[a]ll flesh is as grass."" One book of the Bible ascribed to him refers to the Pauline epistles as ""scripture"" and adds a line about a sow who has washed returning to her mire to a quote from Proverbs. According to the Gospel of John, this man cut the ear off the high priest's servant following Jesus's arrest. The Gospel of Matthew describes how this figure begins to walk on (*) water but begins to sink as his faith wavers.  As Jesus walks by the Sea of Galilee, he tells this fisherman and his brother Andrew that they will become ""fishers of men."" In the final chapter of the Gospel of John, this man reaffirms his love for Jesus three times, reflecting his earlier threefold denial of Jesus. For 10 points, name this man whom Jesus calls a rock, recognized by Roman Catholics as the first pope. ","Saint _Peter_ the Apostle [or _Simon Peter_ or _Simeon Peter_, or any of those answers with _Cephas_ or _Kephas_ in place of Peter; prompt on __Simon__ or __Simeon__]","Religion - Judeo-Christian","Hankin","True","Packet 11","999","Hbunker: Move sow line down. Add clue about Andrew. ||nour_hijazi: The clue about Peter walking on water should definitely be moved down. ||CPiGuy: Moved water clue down per Nour's suggestion.||","11038"
"This Biblical book decries ""those who hold the doctrine of Balaam,"" and those who let Jezebel ""teach and seduce My servants."" It also laments ""you have left your first love."" This book promises various rewards to ""he who overcomes,"" such as receiving a white stone on which a new name is written. In its first chapter, the narrator is commanded to write letters to some churches in Asia Minor, then turns around and sees a vision of (*) seven golden lampstands surrounding Jesus, who has a two-edged sword coming out of his mouth and holds seven stars in his right hand. Jesus says ""I am the Alpha and the Omega"" in this book, which includes the opening of seven seals and the riding of four horsemen. For 10 points, what book that usually ends the New Testament describes the Apocalypse?","Book of _Revelation_ [or _Revelation to John_; accept _Apocalypse of John_ before ""Apocalypse""; do not accept nor prompt on ""Apocalypse"" or ""Revelations""]","Religion - Judeo-Christian","Hankin","True","Packet 04","999","Hbunker: seven should be moved down||CPiGuy: eh, i'd just change it from ""new testament book"" to ""biblical book""; there are plenty of weird mystical prophecies in the old testament so it wouldn't be so obvious||","11039"
"According to Pausanias, the founder of this city fought the Hyantians and the Aonians. Before those people settled here, this city's land was inhabited by Ogygus, who ruled the Ectenians. This city had to pay a tribute of 100 oxen a year to Erginus of Orchomenus, until Hercules led it in revolt. While helping a king of this city, Amphitryon set the infallible hound Laelaps on the uncatchable (*) Teumessian fox. The musician Amphion charmed stones into moving to build the walls of this city. The founder of this city followed a cow until it collapsed, then sowed a dragon's teeth to create the Spartoi warriors. A king of this city solved the riddle of the Sphinx before killing his father and marrying his mother. For 10 points, name this city founded by Cadmus and ruled by Oedipus.","_Thebes_","Myth - Myth","Hankin","True","Packet 12","999","","11041"
"This man leads an attack that is likened to grey wolves on a winter day who elude dogs and shepherds and attack sheep in their pens. In addition to launching that attack is against the Bebrycians, in Lybia this man is told by three nymphs to pay recompense to his mother. A messenger of Queen Arete tells this man to marry a woman he has carried off. Earlier, he had killed that woman's brother, Apsyrtus. At the streams of Anaurus, this man encountered (*) Hera disguised as an old woman; while carrying her across the water, he lost a sandal. This man accepted the challenge of his uncle Pelias and sailed to Colchis, a land ruled by King Aeëtes (Ah-eat-eez). There, he plowed a field with fire-breathing bulls with help from a potion brewed by his future wife, Medea. For 10 points, name this leader of the Argonauts who sought the Golden Fleece.","_Jason_ [or _Iason_; do not accept nor prompt on ""Aeson""]","Myth - Myth","Hankin","False","Packet 10","999","Hbunker: Maybe move Colchis down||","11042"
"This goddess decries the unfairness of one people supposedly committing a ""disgrace"" by ""throw[ing] up a circle of fire"" around their attackers, while those attackers are ""right"" to ""crush under their yoke fields they don't own.""  This goddess is described as holding a sword at her side and controlling the Scaean Gates. As a good omen for a city, this goddess buried the head of a ""spirited (*) horse."" Her ""great force...must be the first you respect in your prayers,"" according to the seer Helenus. She offers her nymph Deiopea to Aeolus if he'll send a hurricane. During a hunt, this goddess sends a storm that forces Dido and Aeneas to take shelter in a cave. She spends much of the ~Aeneid~ harassing the Trojans. For 10 points, name this Roman equivalent of Hera.","_Juno_ [prompt with ""Give the Roman equivalent"" on answers of __Hera__ before mentioned]","Myth - Myth","Hankin","False","Packet 01","999","","11043"
"Songs by a composer from this country are collected in the volume ~A Pilgrim's Solace~. That composer from this country also wrote a set of 21 pieces scored for five viols and a lute, his ~Lachrimae~. Another composer from this country wrote a piece for Catholic masses, ~Gradualia~, and collaborated with his teacher on ~Cantiones Sacrae~. That teacher from this country may have composed one piece in order to one-up Alessandro Striggio's ~Ecce Beatam Lucem~, or to celebrate the birthday of a (*) queen of this country. That piece, a motet whose 40 voices are divided into eight choirs of five, has a title meaning ""Hope in any other,"" ~Spem in alium~. For 10 points, name this home country of Thomas Tallis, the subject of variations by a later composer from here, Ralph Vaughan Williams.","_England_ [accept Great _Britain_ or _U_nited _K_ingdom of Great Britain and \(Northern\) Ireland]","Arts - Classical Music","Hankin","False","Packet 13","999","Hbunker: Left a preliminary powermark.||Hbunker: remove underground reference||","11044"
"In the first movement of the first of these pieces, the soloist plays six mordents on B to open a section representing bird songs. In the first movement of the third of these works, descending F-major arpeggios from the soloist open a section labeled ""~L'ubriaco~,"" or ""the drunkard."" The last of these works ends with ""Sirocco, Boreas, and all the winds in battle""; that piece uses pizzicato strings to depict (*) raindrops hitting windows, and dissonant violin intervals to represent teeth chattering. The composer of these works wrote sonnets to accompany them, such as one about a goatherd's dog. This set of works comprises the first third of ~The Contest Between Harmony and Invention~. For 10 points, name this set of violin concertos by Antonio Vivaldi that begins with ~Spring~ and ends with ~Winter~.","~The _Four Seasons_~ [or _~Le quattro stagioni~_; prompt on ~Il __cimento dell' armonia e dell' inventione__~ or translations such as ~The __Contest Between Harmony and Invention__~ or ~The __Trial of Harmony and Invention__~ before ""Contest""; prompt on __violin concertos__ by Vivaldi before ""concertos""; anti-prompt on individual seasons/movements]","Arts - Classical Music","Hankin","False","Packet 08","999","","11045"
"In a work by this composer - one of his collaborations with lyricist Salomo Franck - the soprano soloist declares in a cheerful D-major recitative that ""to cuddle in playful tenderness is better than Flora's fading delights."" That recitative, ""~Sich üben im Lieben~,"" is from a piece by this composer for solo soprano, solo oboe, and continuo, ""~Weichet nur, betrübte Schatten~."" Dame Myra Hess wrote a piano transcription of the tenth and final movement of this composer's ~Herz und Mund und Tat und Leben~, (*) ""~Jesus bleibet meine Freude~"". This composer's other cantatas include ones titled ~Sleepers Wake~ and ~Coffee Cantata~. Felix Mendelssohn was a key figure in reviving many of this composer's works including the ~St. Matthew Passion~. For 10 points, name this German baroque composer of the ~Brandenburg Concertos~ and ~Toccata and Fugue in D minor~. ","Johann _S_ebastian _Bach_ [prompt on __Bach__]","Arts - Classical Music","Hankin","False","Packet 03","999","joesu235: someone commented on this, but I'm not sure it's that transparent. I'll wait a week before seeing if this really needs to get rid of all the German names. ||","11046"
"This composer marketed one set of string quartets to potential patrons as written in a ""new and special"" way. A quartet in that Opus 33 has a melody in its ~Rondo - Presto~ finale derived from a Slavonic folk tune, has the first violin enter in the first movement on sustained G's, and gets its nickname from the chirping grace-notes it uses throughout; that quartet, ""The Bird,"" joins quartets such as (*) ""The Joke"" in this composer's ""Russian"" quartets. This composer wrote the melody that became ""~Deutschland, Deutschland über alles~,"" and used it as a theme for variations in his ""Emperor Quartet."" He was the dedicatee of sets of string quartets by both Beethoven and Mozart. For 10 points, what ""Father of the String Quartet"" and ""Father of the Symphony"" composed the ~Surprise Symphony~?","Franz Joseph ""Papa"" _Haydn_","Arts - Classical Music","Hankin","False","Packet 16","999","","11047"
"The third movement of a G-minor work for this instrument and piano is a Largo in 3/2 time, which is only 27 measures long. That work, dedicated to a player of this instrument named Auguste Franchomme, was the last major composition of Chopin. This is the solo instrument in a piece that was altered by the man who premiered it, Wilhelm Fitzenhagen.  A concerto for this instrument includes an elegy for Josefina Kounicová based on its composer's song ""Leave me alone"". That concerto was dedicated to Hanus Wihan and was likely based on a concerto for the same instrument by (*) Victor Herbert. This is the solo instrument in Tchaikovsky's ~Variations on a Rococo Theme~. J.S. Bach wrote six unaccompanied suites for this instrument. Elgar wrote a E-minor concerto for this instrument that was popularized by Jacqueline du Pré. For 10 points, name this instrument played Yo-Yo-Ma.  ","violon_cello_","Arts - Classical Music","Hankin","False","Packet 10","999","Hbunker: verify first one is chopin cello sonata||Hbunker: the middle clues about the Dvorak Concerto are kind of hard||joesu235: fixed||","11049"
"In each of the first five measures of a piano piece by this composer, the right hand trills between C-sharp and D-sharp before playing 32nd notes. This composer wrote a piano piece in 4/8 that opens with the left hand playing a D-flat-A-flat interval and described the opening motif of that piece as ""a little circle in water with a little pebble falling into it."" This composer of ""Reflections in the Water"" and ""The Joyous Isle"" ended a piano suite with a syncopated piece named after a minstrel show-inspired black doll. (*) ""The Snow is Dancing"" and ""Serenade of the Doll"" are movements in a suite by this composer whose opening movement is named for a text by Johann Fux. That movement, ""Doctor Gradus ad Parnassum"", opens his ~Children's Corner~. This composer also wrote a symphonic poem that begins with a solo flute playing a descending then ascending chromatic pattern. For 10 points, name this composer of ""Clair de lune"" and ~Prelude to the Afternoon of a Faun~.","Claude _Debussy_","Arts - Classical Music","Hankin","False","Packet 07","999","Hbunker: Golliwogg's Cakewalk is a huge cliff here||joesu235: fixed||","11050"
"Near the end of another piece's second movement, this composer wrote ""Alliluya"" on the top of a page; at the very end of the score, he wrote ""I thank thee, Lord."" In a piece by this composer for piano and orchestra, the pianist begins this 16th-note-rhythm melody on beat three of the second-measure: A-flat, down to F, up to G-flat, up to A-flat, down to D-flat. A work by this composer opens with a loud and long F-minor chord in the piano followed by a single very low F. Both that C-minor piano concerto and a C-sharp minor prelude by this composer opens with (*) bell like chords. This composer included a prominent alto saxophone part in his ~Symphonic Dances~. This composer used an Italian composer's 24th caprice for solo violin as the theme in a piece for piano and orchestra with 24 variations. For 10 points, name this Russian composer of ~Isle of the Dead~ and ~Rhapsody on a Theme of Paganini~.","Sergei \(Vasilievich\) _Rachmaninoff_","Arts - Classical Music","Hankin","False","Packet 12","999","Hbunker: cut reference to his depression||","11051"
