"Tossup Question","Answer","Category","Author","Edited","Packet","Question Number","Comments","Id"
"A militia commander and leader of this group was the first person in US history after George Washington to be granted the rank of Lieutenant General. An army raised by this group, the Danites, fought government forces at the Battle of Crooked River. Before the civil war, Albert Sidney Johnston led a federal assault on this group in 1857. A splinter of this group settled on Beaver Island, Wisconsin after following James (*) Strang. This group was targeted by the ""extermination order"" of Governor Lilburn Boggs of Missouri. This group collaborated with local Native Americans to commit the Mountain Meadows Massacre. This group was expelled from the towns of Carthage and Nauvoo in Illinois before settling in a state they called ""Deseret"", where they were led by the Quorum of the Twelve Apostles, which met in Salt Lake City. For 10 points, name this group led by Joseph Smith and Brigham Young.","_Mormon_ Church [accept Church of Jesus Christ of _Latter Day Saints_ or _LDS_]","History - US","Myers","False","Packet 02","999","CPiGuy: nauvoo legion clue not correct per rama, move back extermination order||","12689"
"The Knights of the Flaming Circle, named for their practice of burning tires at meetings, were formed to oppose this organization. Mary Tyler and Edward Clarke played key roles in publicizing this organization, and two members of this organization, Edward Jackson and Clifford Walker, served as governors of their states in the 1920s. This organization's formation was inspired by a series of novels by Thomas Dixon and was brought about by William J. Simmons. This organization supported John Davis at a (*) Democratic National Convention nicknamed for its dominance by this organization in 1924. This organization was formed at a rally at Stone Mountain, and D. W. Griffith's film ~Birth of a Nation~ inspired a surge in this organization's membership. For 10 points, name this racist organization, a ""revival"" of a reconstruction-era terror group who wore white hoods as their uniform.","Second _K_u _K_lux _K_lan [accept Second _Klan_]","History - US","Myers","False","Packet 12","999","Hbunker: still worried about transparency||Hbunker: cut 1920s and include maybe include clues from Oregon (Pillar of Fire ministries) ||","12691"
"Supposedly, one side's leader at the battle was captured because the Order of the Star he created four years prior stipulated that troops could not retreat further than four steps. Captal de Buch charged one side's left flank in this battle, which began shortly after a failed negotiation of peace led by Cardinal Talleyrand de Périgord. The defeat at this battle partially inspired a peasant revolt led by Etienne Marcel.(*) The Treaty of Bretigny was signed to release king John the Good who was captured at this battle. The Jacquerie revolt began after a defeat at this battle. Edward the Black Prince led British forces at this battle, whose decisive defeat for one side ended the Edwardian phase of a certain war. 10 years after the Battle of Crecy was, for 10 points, what major victory for the British army in the Hundred Years' War?","Battle of _Poitiers_","History - Euro","Hijazi","True","Packet 03","999","nour_hijazi: Feel to edit this, I don't plan on adding more unless I come across another interesting clue.||CPiGuy: jacquerie is too early||","12693"
"In one documentary about this country's history, the CIA agent Archimedes Patti describes his friendship with one of this country's leaders. Frances Fitzgerald's history ~Fire in the Lake~ argued that this country was uniquely hostile to invaders, and Max Boot's book ~The Road Not Taken~ argues for the theories of Edward (*) Lansdale, who served as a military advisor in this country. Mike Gravel read one official government history of this country into the record of the senate after it was leaked to the press by Daniel Ellsberg. The memoir ~How We Won the War~ centers on a conflict in this country and was written by Vo Nguyen Giap (voh ngwen gyahp). For 10 points, name this country where historical disputes have centered on the effectiveness of an American military intervention in the 1960s and 1970s.","_Vietnam_[accept _South Vietnam_, _North Vietnam_]","History - Other","Myers","False","Packet 05","999","Hbunker: packetization likely to change here||","12694"
"While engaging in a contest of wits with Gagnrad, Vafthruthnir prophesizes that this deity will survive the ""end of men."" In the ~Lokasenna~, Loki claims that while this deity was being held hostage by giants, the daughters of Hymir urinated in his mouth. In the Ynglinga Saga, this god was said to have succeeded Odin as one of the legendary kings of Sweden. Following the Aesir-Vanir War this god and his son were exchanged for Hoenir and Mimir. This god was forced to live apart from his wife, (*) Skaði (skah-thee), due to his desire to remain at Nóatún and her desire to live in the mountains. That wife, the daughter of Thjazi (thyah-zee), initially intended to marry Baldr but was taken by the beauty of this god's feet. For 10 points, name this father of Frey and Freya, the Norse god of wealth, wind, and the sea.","_Njörð_r (Nuh-yord)","Myth - Myth","Bubolz","False","Packet 15","999","Hbunker: change sentences that are about peopled related to Njordr||","12695"
"This compound is mixed with potassium persulfate in diethyl ether to form a dimeric peroxide derivative used as an organic explosive. Methyl methacrylate is produced from a reaction of hydrogen cyanide and this compound. This compound is completely miscible with, and does not form an azeotrope with, water due to its strong dipole moment. A special strain of ~Clostridium~ produces n-butanol, ethanol, and this compound in the ABE fermentation.  This compound and phenol are produced from a rearrangement of benzene and propylene in the (*) cumene process. Like methanol, this compound mixed with dry ice creates a -78 Celsius bath. This polar aprotic solvent is missed with sulfuric acid and chromium trioxide in the Jones oxidation. For 10 points, name this simplest ketone found in nail polish remover.","_acetone_  [or 2-_propanone_, _propan-2-one_, _dimethyl ketone_]","Science - Chemistry","Magin ","True","Packet 10","999","","12696"
"Two instances of this functional group and two benzene rings appear in a compound created via an unusual 5,5-sigmatropic migration, called benzidine. Troger's base unusually contains this functional group at bridgeheads. A derivative of naphthalene containing two of this functional group creates the Proton Sponge. Aqueous sodium hydroxide mixed with benzene sulfonyl chloride is used to detect this functional group in the (*) Hinsberg test. This functional group is cleaved from an alkylated phthalimide in the Gabriel synthesis. Depending on the number of alkyl groups attached, this functional group can be primary through quaternary, and they appear alongside a carboxyl in the building blocks of proteins. For 10 points, name this functional group consisting of a carbon single bonded to nitrogen.","_amine_ [accept primary, secondary, tertiary, or quaternary _amine_]","Science - Chemistry","Magin ","True","Packet 05","999","","12697"
"The Bezprizorniye were a group of homeless children left in the aftermath of this war, and they were aided by an organization founded after this war by Anatoly Lunacharsky. One mutiny among soldiers fighting in this war was suppressed with French assistance at La Courtine. The ""battalion of death"", named for its high mortality rates, was an all-female force that fought in this war. General Anton (*) Denikin was charged with suppressing soldiers' political organization during this war. The Brusilov Offensive was one of this war's deadliest operations, and the slogan ""peace, land, and bread"" was coined in opposition to this war. A provisional government under Alexander Kerensky and Georgi Lvov was toppled by its refusal to withdraw from this war. For 10 points, name this war that Russia withdrew from in the Treaty of Brest-Litovsk in 1917.","_World War I_ [accept __Russian Civil War__ until ""La Courtine""]","History - Euro","Myers","False","Packet 15","999","jsmyers: Note: incomplete||Hbunker: Michael Coates said this tossup was kind of a hose for Russian civil war. I'd agree and recommend adding a clue that unambiguously did not lead to Russian Civil War. He buzzed in power after Lunacharsky so he obviously had knowledge. Maybe anti-prompt on ""Russian civil war"" afterwards?||","12699"
"To support this theory, Albert Cohen argued that many low income boys lack the skills to measure up to the middle class peers in face of a criticism that it could only explain the behavior of low income individuals. A revision to this theory includes emotional characteristics and individual social environment and was developed by Robert Agnew. The ""general form"" of this theory argues that the existence of the title phenomenon generates negative emotions such as anger and despair. According to this system, the rejection of institutionalized (*) means and cultural goals causes retreatism which is one of the five adaptations to the title phenomenon. This theory was meant to explain why rates of deviance differed between societies. Robert K. Merton created, for 10 points, what theory in sociology that argues that social structures pressure people to commit crimes?","_Strain_ Theory ","Social Science - Other","Bunker","False","Packet 14","","Hbunker: This may or may not be too long||","12700"
"Ames, Rose, and Anderson simplified one inventory for this disorder to 16 questions. Theodore Millon's subtypes of this disorder include unprincipled, compensatory, and amorous. A recently formulated trait by Malkin et al identifies people who are ""warm-hearted"" and attracted to people with this personality disorder. This disorder, first identified by Robert Waelder, has a 40-question personality inventory invented by Raskin and Hall. Celebrities score (*) higher for this trait that is part of the ""Dark Triad"" along with Psychopathy and Machiavellianism. The DSM-V (five) associates the impairments in self-functioning due to this Cluster B disorder with excessive reference to others for self-esteem. Additionally, there must be impairments in intimate relationships and in empathy. For 10 points, identify this personality disorder named after a beautiful Greek hunter who was only in love with himself and turned into a flower.","_Narcissistic_ Personality Disorder [accept _NPD_ and just _Narcissism_] \(""Echoism"" is the trait invented by Malkin and others\)","Social Science - Psychology/Sociology","Bunker","False","Packet 10","999","ryan.rosenberg: The paper in the first sentence has 56 citations, it seems way too hard for a lead-in here.||Hbunker: Ryan: do you think tossup would be okay if just the lead-in was cut? I'm not a abnormal psychologist or a neurologist so I do not really know where to look for super deep lead-ins here. Should I ask about a drug used to treat NPD?||ryan.rosenberg: I don't know much about NPD either, but this paper talking about the potential exclusion of NPD from the DSM-V seems interesting: https://www.ncbi.nlm.nih.gov/pubmed/20853916. It ultimately was kept in, but that seems like a reasonable leadin. Alternatively, if you're fine going across SS categories, Christopher Lasch's The Culture of Narcissism could make a good clue.||emukherj: Oh hey, things I learned in school. Give me a day, I'll fix this.||","12710"
"The first inorganic conducting polymer discovered consisted entirely of these two elements. A group of drugs that inhibit PPAR-gamma and are used to treat diabetes contains carbon and these two elements in a five-member ring. Carbon is double bonded to both of these elements in the reagent used in the Edman degradation. These two elements are found in the heterocycles of biotin, (*) penicillin, and the five-member ring of thiamine. These two non-oxygen, non-hydrogen, and non-carbon atoms are also found in both cysteine and methionine. Because they lie diagonally across each other on the periodic table, they have very similar electronegativities. For 10 points, name these two elements which are symbolized yellow and blue in molecular model kits, and which have atomic numbers 7 and 16.","_sulfur_ and _nitrogen_ [or _N_ and _S_; accept in either order]","Science - Chemistry","Mukherjee","True","Packet 08","999","emukherj: Made the answerline more interesting and edited appropriately||Hbunker: People said this answerline was strange (?)||emukherj: I don't have much sympathy for that tbh||","12713"
"One person with this surname was an architect who made some eponymous houses as part of a garden city project and designed the residential area Im Langen Loh. A Charles with this surname painted such works as ~Young Woman in Front of a Mirror~ and a ~Southern Landscape~. The concept of expected utility was added to the (*) St. Petersburg paradox by a thinker with this name whose father advised Leonhard Euler. In his ~Ars Conjectandi~, another mathematician with this name produced a formulation of the Law of Large Numbers. ""Dummy variables"" are often described by this surname's namesake distribution. For 10 points, give this surname of a Basel (BAH-sul) family that also names a principle in fluid dynamics about the relationship between pressure and velocity.","_Bernoulli_ [accept any of _Elisabeth Bernoulli_, _Hans Benno Bernoulli_, _Charles Bernoulli_, _Johann Bernoulli_, _Jacob Bernoulli_, _Daniel Bernoulli_]","Other Academic - Other Academic","Bunker","False","Packet 01","999","Hbunker: consider deleting reference to Elizabeth||Hbunker: ""One person with this surname, named Elisabeth led the BAF in 1907 as part of her campaign for prohibition for her country."" was cut||","12715"
"This author wrote a poem in which a man encounters the grave of a virgin and envisions ""Death and this mad heroine"" meeting ""on a mortal wall."" One of this poet's speakers claims that he is ""dumb to tell the hanging man/How of my clay is made that hangman's line. That speaker also says that the force that drives [his] green age"" is his destroyer. The line ""after the first death, there is no other"" ends a poem by this man about the (*) Blitz, which he also wrote about in ""Deaths and Entrances."" The speaker of a poem by this author of ""Death Shall Have No Dominion"" notes that ""grave men, near death...see with blinding sight"" This poet's most famous work is a villanelle that urges men to ""rage against the dying of the light."" For 10 points, name this Welsh poet of ""Do Not Go Gentle Into That Good Night.""","Dylan _Thomas_","Literature - British","Suttell","False","Packet 01","999","","12718"
"Yasumasa Morimura parodied a version of this scene by covering the main figure's face with cabbage. The aftermath of this event is depicted in a grisaille tempera painting by one artist who also painted this scene depicting only a figure's foot on the right side as he lies underneath a pink tent. A non-Guido Reni painter possibly used the death of Beatrice Cenci as inspiration for his depiction of this scene.  A (*) maid stands next to one of the title figures in most depictions of this scene, including works by Mantegna and Caravaggio. The most famous version of this scene was painted after its artist was raped by Agostino Tassi. For 10 points, identify this scene most famously depicted by Artemisia Gentileschi that shows the decapitation of an Assyrian general by a Biblical woman.","_Judith_ Beheading _Holofernes_ [accept reasonable answers that mention both _Judith_ and _Holofernes_, prompt on partial answer]","Arts - Painting","Suttell","True","Packet 06","999","","12719"
"One painter from this movement depicted her sister in a purple dress seated next to her son. That artist's husband was a ceramicist known to frequently disparage her work. A painter from this movement appears on the left side of a balcony in a work by her brother-in-law, who portrayed her in all black with a bouquet of violets. A third artist from this movement showed her mother reading ""Le Figaro"" in one portrait, and frequently depicted women using (*) opera glasses in theaters. One of the ""Three Great Ladies"" of this artistic movement showed a woman dipping a girl's feet into water in a Japanese-influenced work. This movement's foremost American member painted ~The Loge~ and ~The Child's Bath~. For 10 points, identify this mainly French artistic movement whose painters included Berthe Morisot and Mary Cassatt. ","_Impressionism_","Arts - Painting","Suttell","True","Packet 01","999","","12721"
"This artist built a large collection of Kachina dolls when he lived in Arizona for eight years. A monster reaches out and creates a swastika with its limbs in this artist's ~Fireside Angel~. A man wearing orange swim-trunks is seen upside-down in a green pool in a De Chirico-inspired work by this artist. Another of this painter's works features a nude woman wearing an orange fur coat that also covers her face. This artist of ~Disrobing of the Bride~ claimed that one work was ""a kind of farewell"" to his previous experiences with (*) collages. In that painting, a man reaching towards a red and blue knob, and was based on a childhood nightmare. A technique developed by this artist involves rubbing uneven surfaces to create a drawing. For 10 points, identify this artist of ~Two Children are Threatened by a Nightingale~ who pioneered frottage.","Max _Ernst_","Arts - Painting","Suttell","True","Packet 12","999","Hbunker: possibly try to make the description in second line more evocative ||","12722"
"This kingdom's capital became one of the first cities to switch to electric light after its monarch met with Thomas Edison in 1881, and this kingdom redistributed land during a period of reform called the Great Mahele. This kingdom's government was temporarily overthrown by the British naval officer George Paulet in 1843, after which a motto translating as ""The life of the land is perpetuated (*) in righteousness"" was coined. This kingdom elected its monarchs Lunalilo and Kalakaua due to its founding dynasty's extinction.This kingdom was forced to accept the Bayonet Constitution before being overthrown by Lorrin Thurston, and its monarchs ruled from Iolani Palace, where its last queen, Liliuokalani, was imprisoned. For 10 points, name this kingdom that was annexed by the United States more than 60 years before it became the 50th state. ","_Hawaii_","History - US","Myers","False","Packet 09","999","","12731"
"One scholar born in this modern-day country applied bargaining theory to Rawl's original position and wrote ~Game Theory and the Social Contract~. An ethical work by an author born in this modern-day argues that morality comes from ""fellow feeling"". That book by an author from this country was criticized for not offeingr a standard of virtue for measuring the emotions of the moral actor. An economist from this country introduced the idea of consumer surplus, wrote an influential (*) ~Principles of Economics~ book and his namesake demand curve only shows the relationship between the price and quantity of a good. The examples of wine and cloth were central to the theory of comparative advantage in trade, which was developed by a thinker from this country. For 10 points, name this modern-day country of the economists David Ricardo and the author of the ~Theory of Moral Sentiments~, Adam Smith.","_Great Britain_ [also accept _U_nited _K_ingdom, _England_ or _Scotland_]","Social Science - Economics","Bunker","True","Packet 11","999","ryan.rosenberg: The Theory of Moral Sentiments clue seems extremely vague, to the point of not being buzzable. Those are fairly generic things that most ethicists would point to as qualities of a good person. ""Another economist from this country made some early contribution to welfare economics"" is also very vague and not buzzable; adding a specific Ricardian innovation or anything to distinguish Ricardo from other early welfare economists would be great.||Hbunker: that's actually a clue about Marshall but yeah that clue is vague||Hbunker: improved Smith and Marshall clues||Hbunker: clean up the prose||","12732"
"The mass transport of this material is proportional to the third power of the excess wind speed according to Bagnold's formula. Non-wasp organisms of genus ~Ammophila~ have been introduced to features composed of this material in order to preserve them. This material makes up seifs, which are formed when the prevailing winds come from multiple directions. Under one predominant wind direction, this material can form crescent-shaped structures pointing in the wind direction known as (*) barchans. A large expanse of this material made of gypsum covers an area in southern New Mexico named for its ""white"" kind. An area of land mostly covered by this material is referred to as an erg. This material is defined by being finer than gravel but coarser than silt. For 10 points, identify this particulate material which makes up dunes.","_sand_","Science - Earth","Magin ","True","Packet 13","999","CPiGuy: hm, i don't like dropping ""sandstone"" so early. super sweet idea for a TU though. will come back and edit more later||CPiGuy: Edited to be on sand in general for less transparency and more clues.||","12733"
"Kenneth Wilson developed a method of calculating the mass of hadrons and an excited state of these other particles that did not depend on phenomenological observation. That object related to these particles can be seen as the eigenstates of the quantized simplest closed Nambu -- Goto string. The PLUTO experiment confirmed that these particles can be emitted in a way analogous to bremmstrahlung. Using the measurements of the Ellis-Karliner angle, the TASSO experiment showed this particle has a spin of 1. The only particles in the standard model with a possible total angular momentum of 2 or 3 in ground states are hypothetical (*) ""balls"" of these particles. In QCD, this particle has 8 independent types, including red-antiblue plus blue anti-red. This particle acts as the messenger particle of the strong force. For 10 points, name this elementary particle which holds atomic nuclei together.","_gluon_s [accept __Glueballs__ before ""balls"" is read; prompt after mention]","Science - Physics","Kruskie","True","Packet 01","999","Hbunker: Add a clue about quark gluon plasma||Hbunker: remove reference to color force and possibly make less transparent (?)||Hbunker: slight improvement||touchpack: 1) Say ""using measurements of the Ellis-Karliner angle,"" that's more correct than the current wording. 2) ""Bremmstrahlung for this particle"" is a bit of a nonsensical phrase--based on a cursory google I think ""These particles can be emitted in an analogue of bremmstrahlung"" is correct. 3) Cut/replace the second sentence, it's too vague to be useful (and I suspect making it more specific would make it transparent). 4) Is it even true that Wilson calculated the mass of glueballs? I can't find anything saying that from a cursory google. It seems more likely to me that perhaps someone else used Wilson's work on the renormalization group to calculate the mass of glueballs. Also, saying ""an object made of these particles"" is a little transparent--say ""an excited state of these particles"" instead.||Hbunker: fixed. Changed second sentence but may want to do reverse clue look up on QuizDB||","12735"
"One term partially-named after this quantity is the solution to an equation whose right hand side is energy squared minus the product of the squared norm of momentum with the speed of light squared. Some lattice computation have confirmed the existence of one observation partially named for this quantity that is central to a problem in Yang-Mills theory. The (*) log of the ratio of two versions of this quantity are multiplied by the exhaust velocity to yield the change in velocity in the Tsiolkovsky rocket equation. Research into neutrino oscillations may confirm whether it has a positive value for this quantity. The moment of inertia for a pendulum is given by the this quantity times radius of gyration squared. For 10 points, identify this quantity given by linear momentum divided by by velocity: which is multiplied by acceleration to give the net force in Newton's second law.","_mass_ [also accept _mass gap_, _mass shell_, _rest mass_, or _invariant mass_, or just _m_]","Science - Physics","Kruskie","True","Packet 07","999","Hbunker: improve giveaway||touchpack: Honestly I would cut the entire first 3 sentences of this tossup and write from scratch--the first clue is simultaneously guessable (because of the hint at neutrinos) and unparseable (even after seeing the answer and googling, I can't figure out what it's trying to say). The 2nd sentence is just very guessable (hm some quantity in classical mechanics that multiplies acceleration in this equation, you say). The third sentence is definitely not unique (like, velocity would clearly also be 0, and I bet a ton of other things would be 0 as well). For some alternate clues, try reading up on the mass shell and/or the mass gap.||","12736"
