"Tossup Question","Answer","Category","Author","Edited","Packet","Question Number","Comments","Id"
"In her essay ""Lust Horizons: Is the Women's Movement Pro-Sex?"", this author argues against sexual conservatism in the feminist movement. For 10 points each:","Name that journalist and essayist who was one of the founders of the radical feminist group Redstockings who also originated the term ""pro-sex feminism.""","Ellen _Willis_","Willis characterized the supporters of a crusade against these materials as authoritarian and puritanical. Some feminists argue that these materials exploit women but some make a difference between it and erotica.","_porn_ography [accept obvious equivalents]","This feminist author of ~Right-Wing Women~ claimed there was a link between pornography and rape and violence against women. This author and Catharine MacKinnon sought to restrict to access to pornography. ","Andrea _Dworkin_ ","Philosophy - Philosophy","Bunker","True","Packet 10","","Hbunker: make it easier and mention porn ban with McKinnon||","10817"
"This folk song describes California as ""a garden of Eden, a paradise to live in or see."" For 10 points each:","Identify this song, part of the ~Dust Bowl Ballads~, that tells migrants to ""go back to beautiful Texas, Oklahoma, Kansas, Georgia, Tennessee"" if they ""ain't got"" the title phrase, a slang term for money.","_""Do, Re, Mi""_","""Do, Re, Mi"" and the ~Dust Bowl Ballads~ were written by this socialist songwriter of ""This Land is Your Land.""","Woody _Guthrie_","Guthrie was inspired by this literary family when writing ""Do, Re Mi."" Guthrie wrote a song about a member of this family getting ""out of the old Macalester Pen"" and meeting with Preacher Casey.","_Joad_ Family [accept ""_Tom Joad_,"" as that is the song mentioned]","Arts - Other Auditory","Suttell","False","Packet 07","999","","10820"
"This artist portrayed himself as a cellist in one self-portrait, and sits next to a black dog in two others. For 10 points each:","Identify this artist who holds his hair and stares with wide-eyes in ~The Desperate Man.~","Gustave _Courbet_","Courbet is associated with this artistic movement which sought to depict everyday people and subjects. Examples of this style include Courbet's ~The Stone Breakers~ and Millet's ~The Sower~","_Realism_ [do not accept _Naturalism_]","While in Switzerland, Courbet painted multiple still-lifes depicting a dying one of these animals as a symbol of his exile from France.","_Trout_ [prompt on __fish__]","Arts - Painting","Suttell","False","Packet 14","999","Hbunker: put do not accept naturalism||Hbunker: I think this hard part is rather hard||","10835"
"An incident in this city involved Paul rebuking Peter for not sharing his food with gentiles who refused to adhere to Jewish customs. For 10 points each: ","Identify this city where Paul started his evangelism, going from here to Cyprus. Acts 11:26 claims that followers of Jesus in this city were the first ones to be referred to as Christians.","_Antioch_ on the Orontes","Peter is held to be the first bishop of Antioch, whereas 5 different Orthodox and Catholic churches are led by a Patriarch of Antioch. The largest of those churches is this one based in Bkerke, Lebanon, the oldest Eastern Catholic church and the only one to be named after someone.","_Maronite_ Catholic Church [accept Syriac _Maronite_  Church of Antioch]","The successor to Peter as bishop of Antioch is a saint with this name who wrote his own set of 7 letters to various churches. A more famous saint with this name founded the Jesuits and wrote ~Spiritual Exercises~.","_Ignatius_ [or _Ignatius_ of Loyola, or _Ignazio_ Loiolakoa, or _Ignacio_ de Loyola]","Religion - Judeo-Christian","Hijazi","True","Packet 15","999","","10841"
"A notable use of this artistic effect is in a painting of the Dead Christ. For ten points each:","Name this visual effect that, due to the angle of the depicted figure or object, makes features closer to the viewer appear larger and those farther from the viewer appear smaller.","_Foreshortening_ [prompt on __perspective__ or __depth__]","This artist famously used foreshortening in his ~Dead Christ~. He also painted three scenes of St. Sebastian tied to a column.","Andrea _Mantegna_","This artist wears orange robes in his ~Self-Portrait as Saint Sebastian~, which he used to advertise for an exhibition at the Galerie Arnot. He frequently used his lover Wally Neuzil as a model in his erotic portraits.","Egon _Schiele_","Arts - Painting","Suttell","True","Packet 05","999","","10862"
"Answer the following about cattle being killed in Southern Africa. For 10 points each:","This leader ordered all of his realm's milk cows slaughtered after the death of his mother, Nandi, to show their calves what it was like to lose a mother. This Zulu leader developed the ~iklwa~ stabbing spear.","_Shaka_ Zulu","A massive epizootic of this cattle disease caused famines, including one that nearly wiped out the Maasai, throughout Southern Africa in the 1890s. This disease was likely initially spread by Italian colonists in the Horn of Africa.","_rinderpest_","This second-largest ethnic group in South Africa underwent a large famine after the teenaged prophet Nongqawuse (nohng-kah-woo-say) convinced them to slaughter their cattle en masse to resist the British.","_Xhosa_ (hoh-sah)","History - World","Myers","False","Packet 02","999","","10867"
"Answer the following about conflicts between the Byzantine and Sassanid Empires for 10 points each.","The Byzantines and Sassanids supported opposite sides during this event in which an Aksumite expedition crossed the Bab al-Mandab and was only stopped from entering Mecca by its namesake animal refusing to enter the city.","_Year of the Elephant_ [or _ʿĀmu l-Fīl_]","The Byzantine-Sassanid conflicts briefly paused after this treaty, in which the Byzantines promised to withdraw from the fortress of Dara and pay 11,000 pounds of gold in exchange for an end to the Iberian War.","_Eternal Peace_ [accept _Perpetual Peace_, _aperantos eirene_]","This Byzantine emperor signed the Eternal Peace with Kavadh I. This emperor's wife, Theodora, helped him suppress the Nika Riots.","_Justinian_ I the Great","History - World","Myers","False","Packet 09","999","emukherj: Added Arabic name for Year of the Elephant. Otherwise this looks good IMO||","10882"
"This type of cell division occurs asymmetrically during the development of the ovum, resulting in the formation of polar bodies. For 10 points each:","Name this type of cell division that results in four haploid daughter cells. ","_meiosis_ ","In this stage of meiosis, microtubules pull sister chromatids apart. Human oocytes arrest at the stage ~before~ this one via the action of cytostatic factor and enter this phase after fertilization.","_anaphase II_","Some cells in meiosis go through this phase between meiosis I and meiosis II, when the nuclear envelope reforms. The Arabidopsis gene PATRONUS protects centromeres during this phase.","_interkinesis_ [accept _interphase II_; do NOT accept or prompt on ""interphase""]","Science - Biology","Magin ","True","Packet 06","999","Hbunker: I personally don't like this hard part very much and think something can be changed to make it more interesting. Is there a cool protein that is used in anaphase II that is notable?||emukherj: Edited per your suggestion - anaphase II is kind of important because its what eggs go into right after fertilization. I changed around the hard part a little too to add a clue I've been meaning to use. ||","10883"
"Answer the folllowing about homosexuality in medieval India for 10 points each.","In this memoir, a Mughal emperor discussed his attraction to one of his slaves as well as his love for ~ma'joun~ marijuana candy. This memoir describes how its author conquered much of India from his family's base in modern Uzbekistan.","_~Baburnama~_","The Hindu slave Khusrau Khan briefly took this title, succeeding his lover, Qutb-ud-Din. Another holder of this title, Ibrahim Lodi, was defeated at the First Battle of Panipat, and the holders of this title ruled from modern India's capital","_Sultan_ of _Delhi_","This ""father of Urdu literature"" had an ambiguously sexual relationship with his spiritual mentor, Nizamuddin. This author of a collection of five ~masnavis~ is considered an ancestor of the ~qawwali~ genre of music.","_Amir Khusro_","History - World","Myers","False","Packet 16","999","","10884"
"TaqMan probes are commonly used in a precise version of this technique, which more often uses SYBR (""cyber"") dyes. For 10 points each. ","Name this specific type of PCR that allows for quantitation of a sample. GAPDH (""gap""-dee-""h"") is a commonly used as a control in this technique.","quantitative _real-time PCR_ [or _quantitative real-time PCR_; or _qRT-PCR_; or _quantitative reverse transcription PCR_; prompt on ""RT-PCR""; prompt on ""reverse transcription PCR""; accept any preceding answer with ""polymerase chain reaction"" instead of ""PCR""]","This type of gene, like beta-actin or GAPDH (""gap""-dee-""h""), is commonly used as a control in qRT-PCR because they are thought to have stable levels of expression under most conditions.","_housekeeping_ gene [or _reference_ gene]","Many types of PCR use Pfx, Pfu, or Taq, which are thermostable versions of this enzyme. This enzyme synthesizes DNA from a DNA template.","DNA _polymerase_","Science - Biology","Magin ","True","Packet 14","999","Hbunker: This seems difficult to me as currently written but it can be made easier by just requiring polymerase instead of taq polymerase. I know taq is really easy but the easy part should be very gettable.||emukherj: Took your suggestion, and changed 16S rRNA (which is hard to describe) to an equally important thing.||","10885"
"In the arbuscular form of this symbiosis, the fungus penetrates into the cortical cells of the host. For 10 points each:","Name these structures, which are symbiotically formed between the roots green plants and certain fungi. The fungi gain sugars from the plant, while the plant has increased access to water and minerals from the fungi.","_mycorrhizae_ [or _mycorrhiza_]","Mycorrhizae exemplify this type of symbiotic relationship in which both parties experience benefits. Another example of such a relationship exists between fungi and leafcutter ants.","_mutualism_ [or _interspecific cooperation_; prompt on ""cooperation""]","Some ericoid mycorrhizae can act as this kind of chemoheterotroph that breaks down dead matter extracellularly as a carbon source. ","_saprotroph_s [or _saprotrophic_; or _saproprobe_; or _saprophyte_s]","Science - Biology","Magin ","True","Packet 10","999","Hbunker: the third part seems really vague and this bonus is really short overall. It needs at least one more sentence as bonuses should be around 700 characters.||emukherj: Changed the last part.||","10893"
"If this opening remains patent in adulthood, it can allow paradoxical emboli to move directly from the right to the left side of the heart, potentially causing a stroke. For 10 points each: ","Name this opening in the fetal heart that allows blood to bypass the lungs by moving directly between the right and left atrium.","_foramen ovale_ [or _FO_]","Fetuses also have this shunt that connects the pulmonary artery to the descending aorta. After birth it usually becomes the ligamentum arteriosum, but in some people it can remain patent and cause a ""machine-like"" murmur.","_ductus arteriosus_ [or _DA_]","A fetus's blood can bypass the lungs because it receives oxygen from this structure that links the fetus to the uterine wall via the umbilical cord. This structure is expelled as the ""afterbirth"" after delivery.","_placenta_","Science - Biology","Magin ","True","Packet 13","999","Hbunker: I am not a physiology guy so I have no idea how hard this is but it needs a few more clues in all likelihood. ||emukherj: Fixed; I think its M/H/E.||","10894"
"Answer the following about mononucleosis, AKA the kissing disease, for 10 points each.","Mononucleosis is usually caused by this herpes virus that can also be associated with Hodgkin's lymphoma. It's also occasionally caused by CMV, which is a relative of this virus.","_Epstein-Barr_ virus [or _EBV_; _human herpesvirus 4_ or _HHV-4_]","Mononucleosis can cause swelling of this large lymphoid organ on the left side of the abdomen, which is why people are told to avoid sports for a few weeks after recovering. This organ also destroys old red blood cells.","_spleen_","ELISA for EBV typically detects antibodies against EA, viral capsid antigen, and to an antigen named for this cellular organelle. That antigen named for this organelle is expressed during all stages of EBV latency.","_nucleus_ [or _nuclear_ antigen; accept _EBNA_ or _EBNA-1_ or _Epstein-Barr Nuclear Antigen_-1]","Science - Biology","Magin ","True","Packet 12","999","Hbunker: This bonus is too easy. Honestly, Epstein-Barr is probably a middle part at this level so you can change the second part to some harder disease with cold-like symptoms. Or you can ask for some detail about Epstein-Barr.||emukherj: Changed as suggested. Spleen is easy, EBV is medium, nucleus is hard||","10898"
"This compound was originally discovered by Otto Loewi, who termed it ""vagusstoff"" because it was released by the vagus nerve. For 10 points each: ","Name this neurotransmitter which signals across the neuromuscular junction. It binds to both nicotinic and muscarinic receptors, and nerve gas inhibits an esterase that breaks it down.","_acetylcholine_ [or _ACh_]","Antibodies to nicotinic acetylcholine receptors are found in this autoimmune disease, which causes double vision and progressive muscle weakness. It is related to, but not identical with, Lambert-Eaton syndrome.","_myasthenia gravis_ [or _MG_]","A single vescile of acetylcholine induces one of these depolarizations in the post-synaptic muscle fiber. A depolarization about 100 to 200 times greater than this potential is required for full muscle contraction to occur.","_mEPP_ [or _minature end plate potential_; or _minature EPP_; prompt on ""__EPP__"" or ""__end-plate potential__""]","Science - Biology","Magin ","True","Packet 11","999","Hbunker: Is Seratonin the hard part? Again, this needs to be made longer I'd say. I'm also not sure what the easy part is here.||emukherj: I changed this to be all about muscle contraction. I believe acetylcholine easy/ MG medium/ mEPP hard is appropriate - if you still think there isn't an easy part, I can change acetylcholine to muscle.||","10899"
"These cells are selectively destroyed by anti-Yo antibodies, and have large dendritic arbors with extensive spines. For 10 points each: ","Name these cells found between the molecular and granular layers of the cerebellum. Parallel fibers form glutaminergic synapses with these cells, which fire in both simple and complex spike patterns.","_Purkinje_ cell or neuron","Purkinje cells release this inhibitory neurotransmitter, which is formed from the decarboxylation of glutamate. Barbiturates and benzodiazepines enhance activity at this neurotransmitter's receptors.","_GABA_ [or _gamma-amniobutyric acid_]","GABA-A receptors are ligand-gated channels for this ion, whose equilibrium potential is very close to the resting potential of most neurons. When this ion has no net movement across a membrane, it provides shunting inhibition.","_chloride_ [or _Cl-minus_; do NOT accept ""chorine""]","Science - Biology","Magin ","True","Packet 01","999","Hbunker: This bonus is too easy and short. What is the easy/medium/hard parts? I'm not sure, but I think Little's Disease could work for a hard part.||emukherj: If you're considering Purkinje middle and GABA easy, then I can use this as a hard part. I've never heard of Little's disease||","10900"
"An impressionistic night-time painting by this artist depicts a large hole in a frozen pond. For 10 points each:","Name this American modernist painter of ~The Ice Hole~ who used military flags and decorations in his abstract ~Portrait of a German Officer.~","Marsden _Hartley_","Hartley deemed himself the ""painter of"" this US state. He depicted this state's Mt. Katahdin as a black mass rising above a red landscape. Another painter from this state painted works such as ~Eight Bells~ and ~The Fog Warning~","_Maine_ \(The other painter is Winslow Homer\)","This painter depicted his polio-stricken neighbor lying in the grass at her Maine home in ~Christina's World.~ ","_A_ndrew _Wyeth_  [Prompt on only __Wyeth__; do not accept N.C or Jaime Wyeth]","Arts - Painting","Suttell","True","Packet 08","999","","10901"
"Nicholas Hilliard frequently painted miniatures of this ruler, as well as the ~Phoenix~ and ~Pelican~ portraits. For 10 points each","Name this English monarch who is the subject of the ~Darnley~ portrait, which shows her seated next to a crown and sepulchre. She appears in front of a background of fighting ships in the ~Armada~ portrait.","Queen _Elizabeth I_ [Prompt on __Elizabeth__]","Hilliard, as well as his successor Isaac Oliver, often made portraits in this genre. A Jean Fouquet self-portrait from 1450 is thought to be the earliest example of this genre.","Portrait _miniatures_","In the Ditchley portrait, Elizabeth stands on one of these objects. She rests her right hand on a similar one of these objects in the ~Armada~ portrait, representing English expansion.","_Globe_ [accept _map_ of England, as that is what she's specifically standing on in the Ditchley portrait]","Arts - Painting","Suttell","False","Packet 01","999","","10902"
"Works in this series of paintings were created by applying oil paints to Masonite boards with a palette knife. For 10 points each:","Identify this series of minimalist experiments in color theory by Josef Albers that consist of nested shapes.","~_Homage to the Square~_","An ""homage"" to this artist by Maurice Denis shows members of Les Nabis (NAH-bee) surrounding one of this artist's still lifes. This artist is also known for his painting of Mont Sainte-Victoire.","Paul _Cezanne_","This artist depicted a naked woman ""Contemplating the Mediterranean Sea"" in a painting subtitled ~Homage to Rothko~ that depicts Abe Lincoln when viewed from afar. His painting alternately titled ~Homage to Crick and Watson~ has an original title that is a portmanteau of his wife's name and deoxyribonucleic acid.","Salvador _Dalí_","Arts - Painting","Suttell","False","Packet 15","999","Hbunker: This might skew easy. At the very least, I think it should be moved out of finals. ||","10903"
"One section of this massive work depicts three men mourning a dead worker on a conveyor belt. For 10 points each:","Identify this world's largest mural that has both indoor and outdoor panels. This work is found in and around a twelve-sided building called the Polyforum.","~The_ March of Humanity~_ [or ~La _Marcha de la Humanidad_~]","David Siqueiros, the artist of ~The March of Humanity~, is from this Latin American country. Inside the Polyforum, there are paintings of artists from this country such as Jose Clemente Orozco and Diego Rivera.","_Mexico_","Rivera painted Jose Posada staring at La Malinche and walking next to La Calavera Catrina in this mural that features many Mexican historical figures.","~_Dream of a Sunday Afternoon in Alameda Park~_ [accept ~_Sueño de una tarde dominical en la Alameda Central_~ or ~_Dream of a Sunday Afternoon in the Alameda Central_ ~","Arts - Painting","Suttell","True","Packet 04","999","Hbunker: I think this bonus is two easy parts. I don't think there will be a lot of 10s.||esuttell: added a canon Rivera painting||","10904"
"This bonus is scandalous. For 10 points each, answer some questions about nudity in modern art:","A nude man rests his head on his hand and looks away from two naked women in this British artist's ~After Cezanne~. He also depicted Sue Tilly naked on a couch in his portrait ~Benefits Supervisor Sleeping~.","Lucian _Freud_","This artist caused controversy at the 1912 Salon des Indépendants for his ~Nude Descending a Staircase.~","Marcel _Duchamp_","A nude woman descends a staircase in ~Ema~, a ""photo-painting"" that showcases this German artist's hallmark ""blur"" effect. In addition to photo-paintings, this German artist made a series of color chart paintings.","Gerhard _Richter_","Arts - Painting","Suttell","False","Packet 06","999","","10905"
"An artist from this city frequently used animal blood and carcasses in paintings and performance art. For 10 points each:","Name this home to the Actionist movement of the 1960s. More notably, this city was the center of an art movement that included members such as Max Kurzweil and the painter of the ~Beethoven Frieze~.","_Vienna_","The Beethoven Frieze was created by this painter who used gold leaf in his work ~The Kiss~.","Gustav _Klimt_","Klimt's ~Portrait of Adele Bloch-Bauer I~ was the subject of this court case, in which a descendant of Bloch-Bauer successfully sued the Austrian government for rights to the painting. Only the last name of that descendant is required.","Republic of Austria vs. _Altmann_","Arts - Painting","Suttell","False","Packet 10","999","esuttell: Should I add a clue about the Secession building to the first part?||Hbunker: That sounds fine. This bonus seems a tad short.||Hbunker: possible change hard part to something like jugendstyl||esuttell: jugendstil is just the German name for art nouveau, which is already a bonus part||","10906"
"A man in this story remarks that he has his ""death face"" after looking in the mirror while shaving;. For 10 points each:","Identify this short story in which the Lieutenant Shinji and his wife Reiko kill themselves instead of suppressing a mutiny against the army.","""_Patriotism_"" [or _Yūkoku_]","In addition to ""Patriotism,"" this author also wrote the ~Sea of Fertility~ tetralogy and ~Temple of the Golden Pavilion~.","Yukio _Mishima_ [accept names in either order]","In the ~Sea of Fertility~ tetraology, Shigekuni Honda recognizes the reincarnated forms of Kiyoaki Matsugae by this distinct physical feature.","All have _three moles_ [prompt on partial answer; prompt on __birthmarks__ or equivalents]","Literature - World / Ancient","Suttell","True","Packet 03","999","esuttell: harder medium part||","10919"
"Answer the following about literary reactions to the Sacco and Vanzetti trial. For 10 points each:","This author to wrote about Mio Romagna trying to prove his father innocent after his execution in ~Winterset~. This playwright worked with Kurt Weill (Vile) to write a musical based on ~Cry, the Beloved Country~.","Maxwell _Anderson_","One autobiographical section in this novelist's most famous trilogy includes the line ""they have built the electricchair and hired the executioner to throw the switch/ all right we are two nations"" in response to the trial.","John _Dos Passos_","""The Sacco and Vanzetti Poem"" was written by the poet Jacob Glatstein in this language, in which Isaac Bashevis Singer wrote the works, including ~Gimpel the Fool~, for which he won the Nobel Prize.","_Yiddish_","Literature - American","Myers","True","Packet 12","999","Hbunker: This bonus needs to be made harder.||esuttell: sincalir -> maxwell anderson||","10942"
"Answer the following about women during the Hundred Years' War. For 10 points each:","This woman gained the nickname ""Maid of Orleans"" after leading French forces relieving a siege of that city. This woman was canonized after her capture by the Burgundians and execution by the English.","_Joan of Arc_ [accept _Jeanne d'Arc_, _Joan the Maid_]","Joanna of Flanders led the forces of the House of Montfort against the House of Blois after her husband's death in a succession war named for this French region that quickly turned into an Anglo-French proxy conflict.","_Britttany_ [accept _Bretagne_]","This Queen of France took over the administration of the country after her husband, Charles VI, began suffering from Glass Delusion. She suffered a string of defeats to the English during her early 15th century rule.","_Isabeau_ of Bavaria","History - Euro","Myers","False","Packet 09","999","Hbunker: do we really need two 100 years war questions? Aside from that, this is fine.||","10944"
"It is cold in Siberia. Answer some questions about the consequences of that for 10 points each.","Much of Siberia east of the Urals is subject to this phenomenon in which the ground temperature is below the freezing point of water for multiple years at a time. Where this phenomenon occurs, buildings are often built on piles to avoid thawing the ground and destabilizing it.","_permafrost_","These earth-covered mounds of ice are often found in areas with significant permafrost, like northern Siberia and Nunavut. They take their name from the Inuvialuktun name for a small hill.","_pingo_s [or _hydrolaccolith_s, or _bulgunniakh_y]","This term is used to refer to the topographical features such as lakes which result from localized melting of permafrost. This term is used because of the similarity of such features to those which result from the erosion of limestone.","_thermokarst_ [do not accept or prompt on ""karst""]","Science - Earth","Thompson","True","Packet 12","999","CPiGuy: intended e/h/m||","10946"
